{
    "main_theme": "light",
    "base": "#f8f9fa",
    "highlight": "#0081db",
    "sub-highlight": "#0081db",
    "highlight-disabled": "#dadce0",
    "warning": "#a68400",
    "dangerous": "#cf6156",
    "text": "#4d5157",
    "highlight-text": "#f8f9fa",
    "text-disabled": "#babdc2",
    "border": "#dadce0",
    "popup": "#ffffff",
    "popup-text": "#4d5157",
    "popup-item-selected": "#dadce0",
    "statusbar": "#dfe1e5",
    "statusbar-button-hover": "#d1d4da",
    "statusbar-button-pressed": "#c3c7ce",
    "statusbar-button-checked": "#c3c7ce",
    "statusbar-button-disabled": "#edeef0",
    "menubar": "#f8f9fa",
    "menubar-hover": "#dadce0",
    "menubar-item-selected": "#dadce0",
    "toolbar": "#ebebeb",
    "toolbar-button-hover": "#d7d7d7",
    "toolbar-button-pressed": "#c4c4c4",
    "toolbar-button-checked": "#c4c4c4",
    "toolbar-button-disabled": "#ffffff",
    "scrollbar-handle": "#9b9b9d",
    "scrollbar-handle-hover": "#757577",
    "progressbar-chunk": "#0081db",
    "progressbar-text": "#4d5157",
    "button-hover": "#e2eafb",
    "button-pressed": "#b5caf4",
    "button-checked": "#b5caf4",
    "button-disabled": "#dadce0",
    "input-line": "#f8f9fa",
    "input-line-border": "#dadce0",
    "input-line-button-hover": "#e2eafb",
    "slider-subpage-handle": "#0081db",
    "slider-handle-hover": "#7fa6e4",
    "slider-addpage": "#dadce0",
    "tabbar-button-hover": "#0081db",
    "dockwidget-titlebar": "#edeef0",
    "toolbox-tab": "#edeef0",
    "scrollarea-highlight": "#0081db",
    "scrollarea-highlight-disabled": "#0081db",
    "scrollarea-highlight-text": "#4d5157",
    "itemview-alternate": "#e9ecef",
    "itemview-item-hover": "#d3d3d3",
    "itemview-highlight-nonactive": "#e4e6f2",
    "textedit": "#ffffff",
    "textedit-highlight": "#a2d8ff",
    "tableview-highlight-text": "#e4e7eb",
    "listview-item-hover": "#d3d3d3",
    "headerview-section": "#dadce0",
    "headerview-text-active": "#0081db",
    "tableview": "#ffffff",
    "tableview-gridline": "#58595c",
    "contained-button": "#1c73e8",
    "contained-button-hover": "#3781ea",
    "contained-button-pressed": "#7ba9f2",
    "contained-button-border-pressed": "#a9c7f7",
    "contained-button-checked": "#4a90ed",
    "contained-button-disabled": "#dadce0",
    "sidebar": "#333333",
    "sidebar-button-hover": "#44464a",
    "sidebar-button-pressed": "#4f5054",
    "sidebar-button-checked": "#e4e7eb",
    "sidebar-button-disabled": "#202124"
}